{"schema_version":"1.0.0","id":"WEB-NOR-001","tipo_fonte":"MANUAL_OFICIAL","entidade":"Órgão Fictício","titulo":"Manual oficial fictício","url":"https://example.invalid/manual","dominio":"example.invalid","acessado_em":"2026-08-10T10:00:00-03:00","edicao":"2026","versao":null,"data_publicacao":"2026-01-01","vigencia":null,"status_vigencia":"VIGENTE","sha256":null,"questoes_tecnicas":["QT-001"],"finalidade":"Fixture sintética de controle de proveniência.","confianca":{"nivel":"ALTA"},"metodo_verificacao":["Identidade e domínio fictícios conferidos na fixture."],"ultima_verificacao_online":"2026-08-10T10:00:00-03:00","status_uso":"VALIDADA_PARA_USO"}
